priority_rank,project_title,workstream,primary_users_or_beneficiaries,what_the_project_does,why_it_matters_to_nyu,work_completed_to_date,current_output_or_demo,public_url_or_access,current_status,next_30_day_goal,support_needed_from_supervisor,funding_case_for_leadership,lead_consultant,supervisor_owner,last_updated,supervisor_review_status,approval_status,next_review_date,supervisor_notes,notes
1,Evidence Discovery Workbench,Document intelligence,"Researchers, labs, and research support teams","RAG-based research workspace for exploring large corpora with transparent evidence and citations.","Demonstrates reusable AI infrastructure for evidence-grounded research discovery across NYU.","Core retrieval, answer grounding, and citation-trace workflow are live in the workbench.","Live research workbench with citation tracing and evidence-grounded retrieval",https://research-rag-workbench-git-rts-genai-research-hub-dev.apps.cloud.rt.nyu.edu/,Active,"Expand retrieval evaluation, support corpus-specific tuning, onboard pilot research groups, and instrument usage feedback loops.","Help identify pilot groups and agree on which adoption metrics to track.","Funding would support productization, onboarding, evaluation, and wider deployment across research groups.",Andi Shehu,,2026-03-12,,,,,"Flagship infrastructure project"
2,AI History Analysis Studio,Digital humanities,"Humanities researchers, archivists, and digital scholarship teams","AI-assisted environment for exploring early English books through translation, semantic indexing, and retrieval.","Shows that the same AI infrastructure can support humanities research, not only technical domains.","Core archival retrieval and analysis workflows are live for corpus exploration.","Live analysis studio for archival and corpus exploration",https://early-books-rag-workbench-rts-genai-research-hub-dev.apps.cloud.rt.nyu.edu/,Active,"Improve OCR and translation quality, add entity and topic exploration workflows, and validate retrieval against real humanities research questions.","Confirm preferred framing for humanities audiences and any access constraints.","Funding would extend AI tooling into more disciplines and strengthen the case for shared research infrastructure.",Andi Shehu,,2026-03-12,,,,,"Previously labeled AI Corpus Exploration"
3,NYU GenAI Research Hub,Research infrastructure platform,"Research groups, labs, faculty, and institutional leadership","Platform for mapping generative AI projects, use cases, and capabilities across NYU research groups.","Gives leadership a coordinated view of distributed AI work across the university.","Initial platform concept, project taxonomy, and preview workflow are defined.","Private preview platform and network map of NYU GenAI activity",Request early access,In review,"Finalize the data model, add curation and search workflows, onboard initial labs, and establish an update and governance process.","Approve early-access messaging and decide which groups should be included first.","Funding would support platform maturity, data stewardship, onboarding, and institutional coordination around GenAI work.",Andi Shehu,,2026-03-12,,,,,"High strategic value for institutional visibility"
4,NYU GenAI Workshops / Training Engine,Human-AI workflows,"Faculty, staff, and research support teams","Hands-on workshops that help faculty and staff use generative AI for research, teaching, and workflow automation.","Builds the adoption layer needed for AI platforms and tools to be used effectively.","Workshop sessions, training materials, and a repeatable enablement model are active.","Workshop and training system with institutional enablement focus",https://wp.nyu.edu/fas-edtech/2024/11/flash-forc-a-one-day-gen-ai-skills-opportunity-in-jterm/,Active,"Standardize the workshop curriculum, build reusable playbooks and templates, and capture participation and downstream workflow impact.","Decide which workshop metrics should be captured for reporting upward.","Funding would scale AI literacy and turn one-off workshops into a repeatable enablement program.",Andi Shehu,,2026-03-12,,,,,"Support layer for broader platform adoption"
5,Find Puppet Shows Near You,Digital marketing,"Public audiences, faculty-facing outreach, and communications stakeholders","Public-facing discovery site for curated puppet performances with direct venue and ticket links.","Shows ability to ship polished audience-facing tools in addition to internal research systems.","Public site is live with searchable listings and direct venue and ticket routing.","Public-facing listing and discovery site",https://nyu-rts.github.io/puppetfinder/,Active,"Improve content update workflows, expand filtering by venue and date, and track outbound engagement to ticket and venue links.","Decide whether this should be treated as ongoing communications infrastructure and whether engagement metrics should be tracked.","Funding rationale is secondary, but it shows the work can also support outward-facing discovery and communications goals.",Andi Shehu,,2026-03-12,,,,,"Associated with Jeffrey Younger"
6,Retail Shelf Computer Vision,Public health,"Public health researchers and policy-focused teams","Multimodal system for detecting and classifying tobacco products from retail shelf images.","Shows applied AI capability in a domain with clear policy and health relevance.","Core detection and classification pipeline exists in private preview with early policy-analysis use cases.","Private computer vision system with shelf detection and classification",Private preview,In development,"Improve model accuracy, expand labeled data coverage, validate against additional retail environments, and package outputs for policy reporting.","Advise on what can be shared now and whether this should be part of the current funding narrative.","Funding would support domain-specific applied AI work with direct public health relevance and broaden the portfolio of delivered systems.",Andi Shehu,,2026-03-12,,,,,"Not yet ready for broad public visibility"
